{
  "linguistic_drift_forecast_version": "linguistic_drift_forecast.v1",
  "generated_at": "2026-06-24T06:32:45Z",
  "horizon_days": 30,
  "ecosystem_trend": 0.0,
  "forecasts": [
    {
      "gene": "linguistic_drift_forecast_organ",
      "current_risk": 30,
      "current_band": "low",
      "predicted_risk_30d": 59,
      "predicted_band": "medium",
      "lead_time_days": 21,
      "signals": {
        "trajectory_delta": 0.0,
        "latent_alignment": 45.0,
        "mutation_pressure": 0.0,
        "parent_forecast": 25.0,
        "ecosystem_trend": 0.0
      },
      "drivers": [
        "latent alignment gap (header/doc vs genome ssp)",
        "parent gene in forecast or cycle at-risk set"
      ]
    },
    {
      "gene": "linguistic_forecast_calibration_organ",
      "current_risk": 30,
      "current_band": "low",
      "predicted_risk_30d": 59,
      "predicted_band": "medium",
      "lead_time_days": 21,
      "signals": {
        "trajectory_delta": 0.0,
        "latent_alignment": 45.0,
        "mutation_pressure": 0.0,
        "parent_forecast": 25.0,
        "ecosystem_trend": 0.0
      },
      "drivers": [
        "latent alignment gap (header/doc vs genome ssp)",
        "parent gene in forecast or cycle at-risk set"
      ]
    },
    {
      "gene": "linguistic_governance_cycle_organ",
      "current_risk": 30,
      "current_band": "low",
      "predicted_risk_30d": 59,
      "predicted_band": "medium",
      "lead_time_days": 21,
      "signals": {
        "trajectory_delta": 0.0,
        "latent_alignment": 45.0,
        "mutation_pressure": 0.0,
        "parent_forecast": 25.0,
        "ecosystem_trend": 0.0
      },
      "drivers": [
        "latent alignment gap (header/doc vs genome ssp)",
        "parent gene in forecast or cycle at-risk set"
      ]
    },
    {
      "gene": "linguistic_predictive_governance_organ",
      "current_risk": 30,
      "current_band": "low",
      "predicted_risk_30d": 59,
      "predicted_band": "medium",
      "lead_time_days": 21,
      "signals": {
        "trajectory_delta": 0.0,
        "latent_alignment": 45.0,
        "mutation_pressure": 0.0,
        "parent_forecast": 20.0,
        "ecosystem_trend": 0.0
      },
      "drivers": [
        "latent alignment gap (header/doc vs genome ssp)",
        "parent gene in forecast or cycle at-risk set"
      ]
    },
    {
      "gene": "meta_linguistic_governance_organ",
      "current_risk": 30,
      "current_band": "low",
      "predicted_risk_30d": 59,
      "predicted_band": "medium",
      "lead_time_days": 21,
      "signals": {
        "trajectory_delta": 0.0,
        "latent_alignment": 45.0,
        "mutation_pressure": 0.0,
        "parent_forecast": 20.0,
        "ecosystem_trend": 0.0
      },
      "drivers": [
        "latent alignment gap (header/doc vs genome ssp)",
        "parent gene in forecast or cycle at-risk set"
      ]
    },
    {
      "gene": "cisiv_operator_lineage_console",
      "current_risk": 30,
      "current_band": "low",
      "predicted_risk_30d": 58,
      "predicted_band": "medium",
      "lead_time_days": 21,
      "signals": {
        "trajectory_delta": 0.0,
        "latent_alignment": 45.0,
        "mutation_pressure": 0.0,
        "parent_forecast": 0.0,
        "ecosystem_trend": 0.0
      },
      "drivers": [
        "latent alignment gap (header/doc vs genome ssp)"
      ]
    },
    {
      "gene": "coding_organs_stack",
      "current_risk": 30,
      "current_band": "low",
      "predicted_risk_30d": 58,
      "predicted_band": "medium",
      "lead_time_days": 21,
      "signals": {
        "trajectory_delta": 0.0,
        "latent_alignment": 45.0,
        "mutation_pressure": 0.0,
        "parent_forecast": 0.0,
        "ecosystem_trend": 0.0
      },
      "drivers": [
        "latent alignment gap (header/doc vs genome ssp)"
      ]
    },
    {
      "gene": "naming_genome_organ",
      "current_risk": 30,
      "current_band": "low",
      "predicted_risk_30d": 58,
      "predicted_band": "medium",
      "lead_time_days": 21,
      "signals": {
        "trajectory_delta": 0.0,
        "latent_alignment": 45.0,
        "mutation_pressure": 0.0,
        "parent_forecast": 0.0,
        "ecosystem_trend": 0.0
      },
      "drivers": [
        "latent alignment gap (header/doc vs genome ssp)"
      ]
    },
    {
      "gene": "plug_adapter_runtime",
      "current_risk": 30,
      "current_band": "low",
      "predicted_risk_30d": 58,
      "predicted_band": "medium",
      "lead_time_days": 21,
      "signals": {
        "trajectory_delta": 0.0,
        "latent_alignment": 45.0,
        "mutation_pressure": 0.0,
        "parent_forecast": 0.0,
        "ecosystem_trend": 0.0
      },
      "drivers": [
        "latent alignment gap (header/doc vs genome ssp)"
      ]
    },
    {
      "gene": "autobiographical_agency_runtime",
      "current_risk": 26,
      "current_band": "low",
      "predicted_risk_30d": 55,
      "predicted_band": "medium",
      "lead_time_days": 21,
      "signals": {
        "trajectory_delta": 0.0,
        "latent_alignment": 45.0,
        "mutation_pressure": 0.0,
        "parent_forecast": 20.0,
        "ecosystem_trend": 0.0
      },
      "drivers": [
        "latent alignment gap (header/doc vs genome ssp)",
        "parent gene in forecast or cycle at-risk set"
      ]
    },
    {
      "gene": "culture_of_beings_runtime",
      "current_risk": 26,
      "current_band": "low",
      "predicted_risk_30d": 55,
      "predicted_band": "medium",
      "lead_time_days": 21,
      "signals": {
        "trajectory_delta": 0.0,
        "latent_alignment": 45.0,
        "mutation_pressure": 0.0,
        "parent_forecast": 20.0,
        "ecosystem_trend": 0.0
      },
      "drivers": [
        "latent alignment gap (header/doc vs genome ssp)",
        "parent gene in forecast or cycle at-risk set"
      ]
    },
    {
      "gene": "identity_self_model_runtime",
      "current_risk": 26,
      "current_band": "low",
      "predicted_risk_30d": 55,
      "predicted_band": "medium",
      "lead_time_days": 21,
      "signals": {
        "trajectory_delta": 0.0,
        "latent_alignment": 45.0,
        "mutation_pressure": 0.0,
        "parent_forecast": 20.0,
        "ecosystem_trend": 0.0
      },
      "drivers": [
        "latent alignment gap (header/doc vs genome ssp)",
        "parent gene in forecast or cycle at-risk set"
      ]
    },
    {
      "gene": "linguistic_closed_loop_fabric_organ",
      "current_risk": 26,
      "current_band": "low",
      "predicted_risk_30d": 55,
      "predicted_band": "medium",
      "lead_time_days": 21,
      "signals": {
        "trajectory_delta": 0.0,
        "latent_alignment": 45.0,
        "mutation_pressure": 0.0,
        "parent_forecast": 25.0,
        "ecosystem_trend": 0.0
      },
      "drivers": [
        "latent alignment gap (header/doc vs genome ssp)",
        "parent gene in forecast or cycle at-risk set"
      ]
    },
    {
      "gene": "linguistic_drift_predictor_organ",
      "current_risk": 26,
      "current_band": "low",
      "predicted_risk_30d": 55,
      "predicted_band": "medium",
      "lead_time_days": 21,
      "signals": {
        "trajectory_delta": 0.0,
        "latent_alignment": 45.0,
        "mutation_pressure": 0.0,
        "parent_forecast": 20.0,
        "ecosystem_trend": 0.0
      },
      "drivers": [
        "latent alignment gap (header/doc vs genome ssp)",
        "parent gene in forecast or cycle at-risk set"
      ]
    },
    {
      "gene": "linguistic_full_governance_cycle_organ",
      "current_risk": 26,
      "current_band": "low",
      "predicted_risk_30d": 55,
      "predicted_band": "medium",
      "lead_time_days": 21,
      "signals": {
        "trajectory_delta": 0.0,
        "latent_alignment": 45.0,
        "mutation_pressure": 0.0,
        "parent_forecast": 30.0,
        "ecosystem_trend": 0.0
      },
      "drivers": [
        "latent alignment gap (header/doc vs genome ssp)",
        "parent gene in forecast or cycle at-risk set"
      ]
    },
    {
      "gene": "linguistic_governance_attestation_organ",
      "current_risk": 26,
      "current_band": "low",
      "predicted_risk_30d": 55,
      "predicted_band": "medium",
      "lead_time_days": 21,
      "signals": {
        "trajectory_delta": 0.0,
        "latent_alignment": 45.0,
        "mutation_pressure": 0.0,
        "parent_forecast": 25.0,
        "ecosystem_trend": 0.0
      },
      "drivers": [
        "latent alignment gap (header/doc vs genome ssp)",
        "parent gene in forecast or cycle at-risk set"
      ]
    },
    {
      "gene": "linguistic_governance_queue_organ",
      "current_risk": 26,
      "current_band": "low",
      "predicted_risk_30d": 55,
      "predicted_band": "medium",
      "lead_time_days": 21,
      "signals": {
        "trajectory_delta": 0.0,
        "latent_alignment": 45.0,
        "mutation_pressure": 0.0,
        "parent_forecast": 20.0,
        "ecosystem_trend": 0.0
      },
      "drivers": [
        "latent alignment gap (header/doc vs genome ssp)",
        "parent gene in forecast or cycle at-risk set"
      ]
    },
    {
      "gene": "linguistic_governed_lifecycle_fabric_organ",
      "current_risk": 26,
      "current_band": "low",
      "predicted_risk_30d": 55,
      "predicted_band": "medium",
      "lead_time_days": 21,
      "signals": {
        "trajectory_delta": 0.0,
        "latent_alignment": 45.0,
        "mutation_pressure": 0.0,
        "parent_forecast": 20.0,
        "ecosystem_trend": 0.0
      },
      "drivers": [
        "latent alignment gap (header/doc vs genome ssp)",
        "parent gene in forecast or cycle at-risk set"
      ]
    },
    {
      "gene": "linguistic_mutation_organ",
      "current_risk": 26,
      "current_band": "low",
      "predicted_risk_30d": 55,
      "predicted_band": "medium",
      "lead_time_days": 21,
      "signals": {